{
  "ConvertedCurrentPrice": {
    "value": "240.97",
    "_currencyID": "USD"
  },
  "Site": "US",
  "Country": "HK",
  "Location": "Hong Kong",
  "BestOfferEnabled": "false",
  "StartTime": "2017-05-31T09:42:49.000Z",
  "PrimaryCategoryID": "31387",
  "PaymentMethods": "PayPal",
  "Quantity": "1",
  "Storefront": {
    "StoreURL": "http://stores.ebay.com/id=751974798",
    "StoreName": "dabrands"
  },
  "CurrentPrice": {
    "value": "240.97",
    "_currencyID": "USD"
  },
  "EndTime": "2017-06-30T09:42:49.000Z",
  "ShipToLocations": [
    "Worldwide"
  ],
  "ItemSpecifics": {
    "NameValueList": [
      {
        "Value": "4954628159113",
        "Name": "UPC"
      },
      {
        "Value": "Seiko",
        "Name": "Brand"
      },
      {
        "Value": "SRP355",
        "Name": "MPN"
      },
      {
        "Value": "5 Series",
        "Name": "Series"
      },
      {
        "Value": "Men's",
        "Name": "Gender"
      },
      {
        "Value": "Automatic",
        "Name": "Movement"
      },
      {
        "Value": "Stainless Steel",
        "Name": "CaseMaterial"
      },
      {
        "Value": "42mm",
        "Name": "CaseSize"
      },
      {
        "Value": "Push/pull",
        "Name": "Crown"
      },
      {
        "Value": "Black",
        "Name": "DialColor"
      },
      {
        "Value": "Stainless Steel",
        "Name": "Bracelet"
      },
      {
        "Value": "Black",
        "Name": "BraceletColor"
      },
      {
        "Value": "8 inches",
        "Name": "BandLength"
      },
      {
        "Value": "22mm",
        "Name": "BandWidth"
      },
      {
        "Value": "100M",
        "Name": "WaterResistance"
      },
      {
        "Value": "Sapphire",
        "Name": "Crystal"
      },
      {
        "Value": "No",
        "Name": "Alarm"
      },
      {
        "Value": "No",
        "Name": "Chronograph"
      },
      {
        "Value": "No",
        "Name": "DayDate"
      },
      {
        "Value": "Japan",
        "Name": "MadeIn"
      }
    ]
  },
  "IntegratedMerchantCreditCardEnabled": "false",
  "QuantitySoldByPickupInStore": "0",
  "ItemID": "382109026078",
  "HandlingTime": "1",
  "Description": "dabrands HOME WATCHES PENS SUNGLASSES CONTACT Seiko 5 Series SRP355 Watch UPC:4954628159113 Brand:Seiko MPN:SRP355 Series:5 Series Gender:Men's Movement:Automatic CaseMaterial:Stainless Steel CaseSize:42mm Crown:Push/pull DialColor:Black Bracelet:Stainless Steel BraceletColor:Black BandLength:8 inches BandWidth:22mm WaterResistance:100M Crystal:Sapphire Alarm:No Chronograph:No DayDate:No MadeIn:Japan Payment - Payment can be made via PayPal or credit card. - There are no duties/taxes for US customers. Non-US customers are Shipping - We ship globally to all international locations. - We ship within 2-3 days of payment. A tracking number will be provided on the 4th day via eBay's messaging system. Return - Merchandise can be returned in original and unused condition within 30 days of delivery for a refund or exchange. - There is no restocking fee. - Buyers are responsible for shipping charges incurred in returning the item. Authenticity Guarantee - Items are brand \"new-in-the-box\", 100% authentic, with all original parts. - Products are shipped with the original manufacturer's box/case, packaging, and manuals. - Items are not used, refurbished, damaged, or replica products. Store Categories Store Home TissotSeikoCasioCitizenDKNYOMEGAARMANIHAMILTONOther NEWSLETTER Subscribe our newsletter. You will receive our newsletter once a week. SUBSCRIBE Home WATCHES PENS SUNGLASSES CONTACT dabrands Seiko 5 Series SRP355 Watch ITEM SPECIFICS UPC 4954628159113 Brand Seiko MPN SRP355 Series 5 Series Gender Men's Movement Automatic CaseMaterial Stainless Steel CaseSize 42mm Crown Push/pull DialColor Black Bracelet Stainless Steel BraceletColor Black BandLength 8 inches BandWidth 22mm WaterResistance 100M Crystal Sapphire Alarm No Chronograph No DayDate No MadeIn Japan ITEM DESCRIPTION SHIPPING - We ship globally to all international locations. - We ship within 2-3 days of payment. A tracking number will be provided on the 4th day via eBay's messaging system. RETURN - Merchandise can be returned in original and unused condition within 30 days of delivery for a refund or exchange. - There is no restocking fee. - Buyers are responsible for shipping charges incurred in returning the item. PAYMENT - Payment can be made via PayPal or credit card. - There are no duties/taxes for US customers. Non-US customers are",
  "AutoPay": "true",
  "PrimaryCategoryName": "Jewelry & Watches:Watches, Parts & Accessories:Wristwatches",
  "QuantitySold": "0",
  "ViewItemURLForNaturalSearch": "http://www.ebay.com/itm/Seiko-5-Series-SRP355-Watch-/382109026078",
  "NewBestOffer": "false",
  "SKU": "SRP355",
  "ListingType": "FixedPriceItem",
  "GlobalShipping": "false",
  "BidCount": "0",
  "ConditionDisplayName": "New with tags",
  "GalleryURL": "http://thumbs3.ebaystatic.com/pict/3821090260788080_1.jpg",
  "HitCount": "1",
  "PrimaryCategoryIDPath": "281:14324:31387",
  "TimeLeft": "P29DT18H17M24S",
  "ConditionID": "1000",
  "PictureURL": [
    "http://i.ebayimg.com/00/s/OTUwWDk1MA==/z/gzkAAOSw9r1WDH1o/$_1.JPG?set_id=880000500F"
  ],
  "Title": "Seiko 5 Series SRP355 Watch",
  "Seller": {
    "PositiveFeedbackPercent": "100.0",
    "FeedbackScore": "21758",
    "UserID": "dabrands",
    "FeedbackRatingStar": "YellowShooting"
  },
  "ListingStatus": "Active",
  "ReturnPolicy": {
    "ReturnsWithin": "30 Days",
    "Refund": "Money Back",
    "ShippingCostPaidBy": "Buyer",
    "ReturnsAccepted": "Returns Accepted"
  }
}